Siskiyou Transit and General Express – Siskiyou Schedule,Siskiyou Transit and General Express,Siskiyou Schedule,GTFS Schedule,primary,,,"fixed-route,deviated fixed-route,ADA paratransit",Siskiyou County,Siskiyou County,"Siskiyou County,Trillium Inc.",Trillium Inc.,GTFS Schedule,NA,Vendor published,Trillium - To code,,,,Published by Trillium,,,http://data.trilliumtransit.com/gtfs/siskiyou-ca-us/siskiyou-ca-us.zip,1 checked out of 1,Core,
SLO Transit – SLO Schedule,SLO Transit,SLO Schedule,GTFS Schedule,primary,,,fixed-route,City of San Luis Obispo,City of San Luis Obispo,"City of San Luis Obispo,Mecatran",,GTFS Schedule,NA,Unknown,,,,,,,,https://app.mecatran.com/urb/ws/feed/c2l0ZT1zbG90cmFuc2l0O2NsaWVudD1zZWxmO2V4cGlyZT07dHlwZT1ndGZzO2tleT0zZTMwMzM1OTRiMTE2NzA0N2IxNjQwNjA0ZjQwMGMzMzdiM2E1MTQ0,1 checked out of 1,Core,
Spirit Bus – Spirit Bus Schedule,Spirit Bus,Spirit Bus Schedule,GTFS Schedule,primary,,,fixed-route,City of Monterey Park,City of Monterey Park,"City of Monterey Park,Trillium Inc.",Trillium Inc.,GTFS Schedule,NA,Unknown,,,,,,,,http://data.trilliumtransit.com/gtfs/montereypark-ca-us/montereypark-ca-us.zip,0 checked out of 1,Core,
SunLine Transit – SunLine Schedule,SunLine Transit,SunLine Schedule,GTFS Schedule,primary,,,fixed-route,SunLine Transit Agency,SunLine Transit Agency,SunLine Transit Agency,,GTFS Schedule,NA,Unknown,,,,,Olivia to bring up in Data Assessment call.,*,,https://www.sunline.org/transit/google_transit.zip,1 checked out of 1,Core,
Torrance Transit – Torrance Schedule,Torrance Transit,Torrance Schedule,GTFS Schedule,primary,,,fixed-route,City of Torrance,City of Torrance,City of Torrance,,GTFS Schedule,NA,Unknown,,,,,,,,https://transit.torranceca.gov/home/showdocument?id=16673,1 checked out of 1,Core,
Trinity Transit – Trinity Schedule,Trinity Transit,Trinity Schedule,GTFS Schedule,primary,,,fixed-route,Trinity County,Trinity County,"Trinity County,Trillium Inc.",Trillium Inc.,GTFS Schedule,NA,Vendor published,,Transit.land has an updated link that seems active for Trinity,,,Published by Trillium,,,http://data.trilliumtransit.com/gtfs/weaverville-ca-us/weaverville-ca-us.zip,1 checked out of 1,Core,
Tulare County Area Transit – TCRTA Schedule,Tulare County Area Transit,TCRTA Schedule,GTFS Schedule,primary,,,"ADA paratransit,deviated fixed-route,fixed-route",Tulare County Regional Transit Agency,Tulare County Regional Transit Agency,Tulare County Regional Transit Agency,"Tulare County Regional Transit Agency,Tulare County Association of Governments",GTFS Schedule,,Needed,Trillium - To code,,,,,"C10,C20,C30,C40,C50,C60,C70,C80,C90",,https://tularecog.org/tcag/data-gis-modeling/gtfs-data/tulare-county-regional-transit-agency-tcrta-gtfs,1 checked out of 1,Core,
Unitrans – Unitrans Schedule,Unitrans,Unitrans Schedule,GTFS Schedule,primary,530-752-BUSS,,fixed-route,"""University of California, Davis""","""University of California, Davis""","""University of California, Davis""",Sacramento Regional Transit District,GTFS Schedule,NA,Provider to Publish,,,,,"They gave us the Excel+macro they use to create GTFS data. It has other errors, which we can fix and add Fares if we have time.",,,https://unitrans.ucdavis.edu/media/gtfs/Unitrans_GTFS.zip,1 checked out of 1,Core,
Victor Valley Transit – Victor Valley Schedule,Victor Valley Transit,Victor Valley Schedule,GTFS Schedule,primary,,,fixed-route,Victor Valley Transit Authority,Victor Valley Transit Authority,"Victor Valley Transit Authority,Trillium Inc.",Trillium Inc.,GTFS Schedule,NA,Vendor published,,,,,Published by Trillium,,,http://data.trilliumtransit.com/gtfs/victorville-ca-us/victorville-ca-us.zip,1 checked out of 1,Core,
Visalia Transit – Visalia Schedule,Visalia Transit,Visalia Schedule,GTFS Schedule,primary,,,fixed-route,City of Visalia,City of Visalia,GMV Syncromatics Inc,GMV Syncromatics Inc,GTFS Schedule,NA,Unknown,,,,,A GMV cilent. They're figuring out internally how to pass through Fare data.,,,https://visaliatransit.info/GTFS,1 checked out of 1,Core,
Yolobus – Yolobus Schedule,Yolobus,Yolobus Schedule,GTFS Schedule,primary,d139e461-175c-4156-beb0-e6a23b64d978,,"fixed-route,deviated fixed-route",Yolo County Transportation District,Yolo County Transportation District,Yolo County Transportation District,Yolo County Transportation District,GTFS Schedule,NA,Provider to Publish,Needed - Existing GTFS,,,,Part of the regional data SacRT agreed to publish in October,,,http://www.yolobus.com/GTFS/google_transit.zip,1 checked out of 1,Core,
Yosemite Area Regional Transportation System – YARTS Schedule,Yosemite Area Regional Transportation System,YARTS Schedule,GTFS Schedule,primary,,,"seasonal,fixed-route",Yosemite Area Regional Transportation System,Yosemite Area Regional Transportation System,Yosemite Area Regional Transportation System,Trillium Inc.,GTFS Schedule,NA,Vendor published,,,,,Published by Trillium,,,http://data.trilliumtransit.com/gtfs/yosemite-ca-us/yosemite-ca-us.zip,1 checked out of 1,Core,
Yuba-Sutter Transit – Yuba-Sutter Schedule,Yuba-Sutter Transit,Yuba-Sutter Schedule,GTFS Schedule,primary,,local,fixed-route,Yuba-Sutter Transit Authority,Yuba-Sutter Transit Authority,"Yuba-Sutter Transit Authority,Trillium Inc.",Trillium Inc.,GTFS Schedule,NA,Vendor published,,,,,Published by Trillium,,,http://data.trilliumtransit.com/gtfs/yubasutter-ca-us/yubasutter-ca-us.zip,1 checked out of 1,Core,
Yuma County Area Transit – Yuma Schedule,Yuma County Area Transit,Yuma Schedule,GTFS Schedule,primary,,,fixed-route,Yuma County Intergovernmental Public Transportation Authority,Yuma County Intergovernmental Public Transportation Authority,Yuma County Intergovernmental Public Transportation Authority,,GTFS Schedule,NA,Unknown,,,,,Ruth cold-emailed their service manager.,,,https://www.ycipta.org/gtfs/google_transit.zip,1 checked out of 1,Core,
Mountain Transit – Mountain Transit Schedule,Mountain Transit,Mountain Transit Schedule,GTFS Schedule,primary,,,fixed-route,Mountain Area Regional Transit Authority,Mountain Area Regional Transit Authority,"Mountain Area Regional Transit Authority,TransLoc",TransLoc,GTFS Schedule,NA,Vendor published,,,,,,,,https://api.transloc.com/gtfs/mountaintransit.zip,1 checked out of 1,Other Public Transit,
Glenn Ride – Glenn Schedule,Glenn Ride,Glenn Schedule,GTFS Schedule,primary,,,"deviated fixed-route,fixed-route,ADA paratransit",Glenn County,Paratransit Services Inc.,Trillium Inc.,Trillium Inc.,GTFS Schedule,NA,Vendor published,Trillium - Coded,,"GTFS Into Google,GTFS Schedule Creation",Train transit provider to own,,,,http://data.trilliumtransit.com/gtfs/glenn-ca-us/glenn-ca-us.zip,1 checked out of 1,Core,
Lynwood Breeze – Lynwood Schedule,Lynwood Breeze,Lynwood Schedule,GTFS Schedule,primary,,,fixed-route,City of Lynwood,Parking Company of America,Trillium Inc.,Trillium Inc.,GTFS Schedule,NA,Vendor published,,,,,Published by Trillium,,,http://data.trilliumtransit.com/gtfs/lynwood-ca-us/lynwood-ca-us.zip,1 checked out of 1,Core,
Lassen Rural Bus – Lassen Schedule,Lassen Rural Bus,Lassen Schedule,GTFS Schedule,primary,,,"fixed-route,deviated fixed-route,ADA paratransit",Lassen Transit Service Agency,Lassen Transit Service Agency,Trillium Inc.,Trillium Inc.,GTFS Schedule,NA,Vendor published,Trillium - To code,,,,Published by Trillium,,,http://data.trilliumtransit.com/gtfs/lassen-ca-us/lassen-ca-us.zip,1 checked out of 1,Core,
TRACER – Tracy Schedule,TRACER,Tracy Schedule,GTFS Schedule,primary,,,fixed-route,City of Tracy,City of Tracy,Trillium Inc.,Trillium Inc.,GTFS Schedule,NA,Unknown,,,,,,,,http://data.trilliumtransit.com/gtfs/tracy-ca-us/tracy-ca-us.zip,1 checked out of 1,Core,
Sanger Express – Fresno County Schedule,Sanger Express,Fresno County Schedule,GTFS Schedule,primary,171,,"fixed-route,reservations",Fresno County Rural Transit Agency,Fresno County Rural Transit Agency,Trillium Inc.,Trillium Inc.,GTFS Schedule,NA,Unknown,Needed - Existing GTFS,,,,A Trapeze client. Trapeze offered to facilitate a pilot once SacRT is complete. Ruth also emailed mstites@fresnocog.org in October.,6316,,http://data.trilliumtransit.com/gtfs/fresnocounty-ca-us/fresnocounty-ca-us.zip,1 checked out of 1,Core,
LAX Fly Away – LAX FlyAway Schedule,LAX Fly Away,LAX FlyAway Schedule,GTFS Schedule,primary,,,fixed-route,Los Angeles World Airports,Coach USA Inc.,Los Angeles World Airports,Los Angeles World Airports,GTFS Schedule,NA,Provider published,,,,,Lilly facilitated an introduction and they're now publishing the Fares data we gave them.,,,https://www.flylax.com/-/media/flylax/flyaway/gtfs/google_transit.ashx,1 checked out of 1,Other Public Transit,
California Zephyr – Amtrak Schedule,California Zephyr,Amtrak Schedule,GTFS Schedule,primary,,,fixed-route,Amtrak,Amtrak,Amtrak,California Integrated Travel Project,GTFS Schedule,NA,Unknown,,,,,,"96,93",,https://content.amtrak.com/content/gtfs/GTFS.zip,1 checked out of 1,Other Public Transit,
Taft Area Transit – Taft Schedule,Taft Area Transit,Taft Schedule,GTFS Schedule,primary,,,fixed-route,City of Taft,City of Taft,Trillium Inc.,Trillium Inc.,GTFS Schedule,NA,Needs GTFS Schedule,,,GTFS Schedule Creation,"Get into google,Ask Kern to own",,,,http://data.trilliumtransit.com/gtfs/taft-co-us/taft-ca-us.zip,1 checked out of 1,Core,
Gateway Coach – Sierra Madre Schedule,Gateway Coach,Sierra Madre Schedule,GTFS Schedule,primary,,,fixed-route,City of Sierra Madre,City of Sierra Madre,Los Angeles County Metropolitan Transportation Authority,Los Angeles County Metropolitan Transportation Authority,GTFS Schedule,NA,Needs GTFS Schedule,,,GTFS Schedule Creation,Get into google,,,,https://github.com/LACMTA/los-angeles-regional-gtfs/raw/main/sierramadre-ca-us/sierramadre-ca-us.zip,1 checked out of 1,Other Public Transit,
Rosemead Explorer – Rosemead Schedule,Rosemead Explorer,Rosemead Schedule,GTFS Schedule,primary,,,fixed-route,First Transit,City of Rosemead,Los Angeles County Metropolitan Transportation Authority,Los Angeles County Metropolitan Transportation Authority,GTFS Schedule,NA,Needs GTFS Schedule,,,GTFS Schedule Creation,Get into google,,,,https://github.com/LACMTA/los-angeles-regional-gtfs/raw/main/rosemead-ca-us/rosemead-ca-us.zip,1 checked out of 1,,
Get Around Town Express – Get Around Town Express Schedule,Get Around Town Express,Get Around Town Express Schedule,GTFS Schedule,primary,,,fixed-route,City of South Gate,City of South Gate,Los Angeles County Metropolitan Transportation Authority,Los Angeles County Metropolitan Transportation Authority,GTFS Schedule,NA,Needs GTFS Schedule,,,GTFS Schedule Creation,Get into google,,,,https://github.com/LACMTA/los-angeles-regional-gtfs/raw/main/getaroundtownexpress-ca-us/getaroundtownexpress-ca-us.zip,1 checked out of 1,Core,
Elk Grove Transit Services – Elk Grove Schedule,Elk Grove Transit Services,Elk Grove Schedule,GTFS Schedule,primary,,,fixed-route,Sacramento Regional Transit District,Sacramento Regional Transit District,GMV Syncromatics Inc,City of Elk Grove,GTFS Schedule,NA,,,,,,,,,https://elkgrovetransit.com/gtfs,1 checked out of 1,Core,
Reds Meadow Shuttle – Eastern Sierra Schedule,Reds Meadow Shuttle,Eastern Sierra Schedule,GTFS Schedule,primary,,,"fixed-route,seasonal,reservations",Eastern Sierra Transit Authority,Eastern Sierra Transit Authority,"Eastern Sierra Transit Authority,Trillium Inc.",Trillium Inc.,GTFS Schedule,NA,Vendor published,Needed - Special service,,,,Published by Trillium,?,,http://data.trilliumtransit.com/gtfs/easternsierra-ca-us/easternsierra-ca-us.zip,1 checked out of 1,Core,
ESTA 395 Routes – Eastern Sierra Schedule,ESTA 395 Routes,Eastern Sierra Schedule,GTFS Schedule,primary,,,"fixed-route,reservations",Eastern Sierra Transit Authority,Eastern Sierra Transit Authority,"Eastern Sierra Transit Authority,Trillium Inc.",Trillium Inc.,GTFS Schedule,NA,Vendor published,Needed - Existing GTFS,,,,Published by Trillium,"561,562,563,564",,http://data.trilliumtransit.com/gtfs/easternsierra-ca-us/easternsierra-ca-us.zip,1 checked out of 1,Core,
Mammoth Lakes Trolleys – Eastern Sierra Schedule,Mammoth Lakes Trolleys,Eastern Sierra Schedule,GTFS Schedule,primary,,,fixed-route,Eastern Sierra Transit Authority,Eastern Sierra Transit Authority,"Eastern Sierra Transit Authority,Trillium Inc.",Trillium Inc.,GTFS Schedule,NA,Vendor published,,,,,Published by Trillium,6178,,http://data.trilliumtransit.com/gtfs/easternsierra-ca-us/easternsierra-ca-us.zip,1 checked out of 1,Core,
Eureka Transit Service – Humboldt Schedule,Eureka Transit Service,Humboldt Schedule,GTFS Schedule,primary,2,,fixed-route,City of Eureka,City of Eureka,"Humboldt Transit Authority,Trillium Inc.",Trillium Inc.,GTFS Schedule,NA,Vendor published,,,,,Published by Trillium,,,http://data.trilliumtransit.com/gtfs/humboldtcounty-ca-us/humboldtcounty-ca-us.zip,1 checked out of 1,Core,
Redwood Transit System – Humboldt Schedule,Redwood Transit System,Humboldt Schedule,GTFS Schedule,primary,1,"Redwood, SHI",fixed-route,Humboldt Transit Authority,Humboldt Transit Authority,"Humboldt Transit Authority,Trillium Inc.",Trillium Inc.,GTFS Schedule,NA,Vendor published,,,,,Published by Trillium,,,http://data.trilliumtransit.com/gtfs/humboldtcounty-ca-us/humboldtcounty-ca-us.zip,1 checked out of 1,Core,
Willow Creek – Humboldt Schedule,Willow Creek,Humboldt Schedule,GTFS Schedule,primary,1,Willow_Creek,fixed-route,Humboldt Transit Authority,Humboldt Transit Authority,"Humboldt Transit Authority,Trillium Inc.",Trillium Inc.,GTFS Schedule,NA,Vendor published,,,,,Published by Trillium,,,http://data.trilliumtransit.com/gtfs/humboldtcounty-ca-us/humboldtcounty-ca-us.zip,1 checked out of 1,Core,
NCTD Coaster – North County Schedule,NCTD Coaster,North County Schedule,GTFS Schedule,primary,,,fixed-route,North County Transit District,North County Transit District,North County Transit District,,GTFS Schedule,NA,Unknown,,,,,Ruth emailed rcashin@nctd.org,"398,498",,http://www.gonctd.com/google_transit.zip,1 checked out of 1,Core,
NCTD Sprinter – North County Schedule,NCTD Sprinter,North County Schedule,GTFS Schedule,primary,,,fixed-route,North County Transit District,North County Transit District,North County Transit District,,GTFS Schedule,NA,Unknown,,,,,Ruth emailed rcashin@nctd.org,399,,http://www.gonctd.com/google_transit.zip,1 checked out of 1,Core,
SJRTD Commuter – San Joaquin Schedule,SJRTD Commuter,San Joaquin Schedule,GTFS Schedule,primary,,,fixed-route,San Joaquin Regional Transit District,San Joaquin Regional Transit District,San Joaquin Regional Transit District,San Joaquin Regional Transit District,GTFS Schedule,NA,Provider to Publish,,,,,Agreed to push this out themselves.,"120,150,152,163",,http://sanjoaquinrtd.com/RTD-GTFS/RTD-GTFS.zip,1 checked out of 1,Core,
SJRTD Hopper – San Joaquin Schedule,SJRTD Hopper,San Joaquin Schedule,GTFS Schedule,primary,,,"deviated fixed-route,ADA paratransit,reservations",San Joaquin Regional Transit District,San Joaquin Regional Transit District,San Joaquin Regional Transit District,San Joaquin Regional Transit District,GTFS Schedule,NA,Provider to Publish,Trillium - To code,,,,Agreed to push this out themselves.,"1,2,3,4,5,6,9,90,91,93,95,97",,http://sanjoaquinrtd.com/RTD-GTFS/RTD-GTFS.zip,1 checked out of 1,Core,
SJRTD BRT Express – San Joaquin Schedule,SJRTD BRT Express,San Joaquin Schedule,GTFS Schedule,primary,,,fixed-route,San Joaquin Regional Transit District,San Joaquin Regional Transit District,San Joaquin Regional Transit District,San Joaquin Regional Transit District,GTFS Schedule,NA,Provider to Publish,,,,,Agreed to push this out themselves.,"40,43,44,47,49",,http://sanjoaquinrtd.com/RTD-GTFS/RTD-GTFS.zip,1 checked out of 1,Core,
Edmund D. Edelman Children’s Court Shuttle – LADPW Schedule,Edmund D. Edelman Children’s Court Shuttle,LADPW Schedule,GTFS Schedule,primary,,,fixed-route,Los Angeles County,Los Angeles County,"Trillium Inc.,Los Angeles County",Trillium Inc.,GTFS Schedule,NA,Vendor published,,,,,Published by Trillium,13054,,http://data.trilliumtransit.com/gtfs/dpwlacounty-ca-us/dpwlacounty-ca-us.zip,1 checked out of 1,Core,
the Link Willowbrook – LADPW Schedule,the Link Willowbrook,LADPW Schedule,GTFS Schedule,primary,,,fixed-route,Los Angeles County,Los Angeles County,"Trillium Inc.,Los Angeles County",Trillium Inc.,GTFS Schedule,NA,Vendor published,,,,,Published by Trillium,"13068,13315",,http://data.trilliumtransit.com/gtfs/dpwlacounty-ca-us/dpwlacounty-ca-us.zip,1 checked out of 1,Core,
Heights Hopper Shuttle – LADPW Schedule,Heights Hopper Shuttle,LADPW Schedule,GTFS Schedule,primary,,,fixed-route,Los Angeles County,Los Angeles County,"Trillium Inc.,Los Angeles County",Trillium Inc.,GTFS Schedule,NA,Vendor published,,,,,Published by Trillium,13053,,http://data.trilliumtransit.com/gtfs/dpwlacounty-ca-us/dpwlacounty-ca-us.zip,1 checked out of 1,Core,
Sunshine Shuttle – LADPW Schedule,Sunshine Shuttle,LADPW Schedule,GTFS Schedule,primary,,,fixed-route,Los Angeles County,Los Angeles County,"Trillium Inc.,Los Angeles County",Trillium Inc.,GTFS Schedule,NA,Vendor published,,,,,Published by Trillium,"13058,13059,13060",,http://data.trilliumtransit.com/gtfs/dpwlacounty-ca-us/dpwlacounty-ca-us.zip,1 checked out of 1,Core,
East Valinda Shuttle – LADPW Schedule,East Valinda Shuttle,LADPW Schedule,GTFS Schedule,primary,,,fixed-route,Los Angeles County,Los Angeles County,"Trillium Inc.,Los Angeles County",Trillium Inc.,GTFS Schedule,NA,Vendor published,,,,,Published by Trillium,13051,,http://data.trilliumtransit.com/gtfs/dpwlacounty-ca-us/dpwlacounty-ca-us.zip,1 checked out of 1,Core,
Topanga Beach Bus – LADPW Schedule,Topanga Beach Bus,LADPW Schedule,GTFS Schedule,primary,,,fixed-route,Los Angeles County,Los Angeles County,"Trillium Inc.,Los Angeles County",Trillium Inc.,GTFS Schedule,NA,Vendor published,,,,,Published by Trillium,13049,,http://data.trilliumtransit.com/gtfs/dpwlacounty-ca-us/dpwlacounty-ca-us.zip,1 checked out of 1,Core,
Los Angeles County Wellness Center Shuttle – LADPW Schedule,Los Angeles County Wellness Center Shuttle,LADPW Schedule,GTFS Schedule,primary,,,fixed-route,Los Angeles County,Los Angeles County,"Trillium Inc.,Los Angeles County",Trillium Inc.,GTFS Schedule,NA,Vendor published,,,,,Published by Trillium,13061,,http://data.trilliumtransit.com/gtfs/dpwlacounty-ca-us/dpwlacounty-ca-us.zip,1 checked out of 1,Core,
El Sol Shuttle – LADPW Schedule,El Sol Shuttle,LADPW Schedule,GTFS Schedule,primary,,,fixed-route,Los Angeles County,Los Angeles County,"Trillium Inc.,Los Angeles County",Trillium Inc.,GTFS Schedule,NA,Vendor published,,,,,Published by Trillium,"13055,13056,13057",,http://data.trilliumtransit.com/gtfs/dpwlacounty-ca-us/dpwlacounty-ca-us.zip,1 checked out of 1,Core,
OC Bus – OCTA Schedule,OC Bus,OCTA Schedule,GTFS Schedule,primary,,,fixed-route,Orange County Transportation Authority,Orange County Transportation Authority,Orange County Transportation Authority,Orange County Transportation Authority,GTFS Schedule,NA,Unknown,,,,,Via offered to introduce us as part of the Flex rollout,*,,https://octa.net/current/google_transit.zip,1 checked out of 1,Core,
  – Bay Area 511 Schedule, ,Bay Area 511 Schedule,GTFS Schedule,primary,VN,,on-demand,Napa Valley Transportation Authority,Napa Valley Transportation Authority,Metropolitan Transportation Commission,Metropolitan Transportation Commission,GTFS Schedule,NA,Vendor published,Trillium - To code,,,,MTC,VN:Yountville Trolley,,http://api.511.org/transit/datafeeds?api_key={{ MTC_511_API_KEY}}&operator_id=RG,1 checked out of 1,Core,
St Helena Shuttle – Bay Area 511 Schedule,St Helena Shuttle,Bay Area 511 Schedule,GTFS Schedule,primary,VN,,"on-demand,fixed-route",Napa Valley Transportation Authority,Napa Valley Transportation Authority,Metropolitan Transportation Commission,Metropolitan Transportation Commission,GTFS Schedule,NA,Vendor published,Trillium - To code,,,,MTC,VN:St Helena Shuttle,,http://api.511.org/transit/datafeeds?api_key={{ MTC_511_API_KEY}}&operator_id=RG,1 checked out of 1,Core,
FLX Pacifica – Bay Area 511 Schedule,FLX Pacifica,Bay Area 511 Schedule,GTFS Schedule,primary,SM,,"deviated fixed-route,reservations",San Mateo County Transit District,San Mateo County Transit District,Metropolitan Transportation Commission,Metropolitan Transportation Commission,GTFS Schedule,NA,Vendor published,Published - Needs Flex Additions,,,,MTC,SM:FLX,,http://api.511.org/transit/datafeeds?api_key={{ MTC_511_API_KEY}}&operator_id=RG,1 checked out of 1,Core,
San Francisco Cable Cars – Bay Area 511 Schedule,San Francisco Cable Cars,Bay Area 511 Schedule,GTFS Schedule,primary,SF,,fixed-route,City and County of San Francisco,City and County of San Francisco,Metropolitan Transportation Commission,Metropolitan Transportation Commission,GTFS Schedule,NA,Vendor published,,,,,MTC,"SF:PM,SF:PH,SF:C",,http://api.511.org/transit/datafeeds?api_key={{ MTC_511_API_KEY}}&operator_id=RG,1 checked out of 1,Core,
Muni Metro – Bay Area 511 Schedule,Muni Metro,Bay Area 511 Schedule,GTFS Schedule,primary,SF,,fixed-route,City and County of San Francisco,City and County of San Francisco,Metropolitan Transportation Commission,Metropolitan Transportation Commission,GTFS Schedule,NA,Vendor published,,,,,MTC,"SF:J,SF:KT,SF:L,SF:M,SF:N,",,http://api.511.org/transit/datafeeds?api_key={{ MTC_511_API_KEY}}&operator_id=RG,1 checked out of 1,Core,
Market Street Historic Railway – Bay Area 511 Schedule,Market Street Historic Railway,Bay Area 511 Schedule,GTFS Schedule,primary,SF,,fixed-route,City and County of San Francisco,City and County of San Francisco,Metropolitan Transportation Commission,Metropolitan Transportation Commission,GTFS Schedule,NA,Vendor published,,,,,MTC,SF:F,,http://api.511.org/transit/datafeeds?api_key={{ MTC_511_API_KEY}}&operator_id=RG,1 checked out of 1,Core,
VTA Bus – Bay Area 511 Schedule,VTA Bus,Bay Area 511 Schedule,GTFS Schedule,primary,SC,,fixed-route,Santa Clara Valley Transportation Authority,Santa Clara Valley Transportation Authority,Metropolitan Transportation Commission,Metropolitan Transportation Commission,GTFS Schedule,NA,Vendor published,,,,,MTC,*,,http://api.511.org/transit/datafeeds?api_key={{ MTC_511_API_KEY}}&operator_id=RG,1 checked out of 1,Core,
VTA Express Bus – Bay Area 511 Schedule,VTA Express Bus,Bay Area 511 Schedule,GTFS Schedule,primary,SC,,fixed-route,Santa Clara Valley Transportation Authority,Santa Clara Valley Transportation Authority,Metropolitan Transportation Commission,Metropolitan Transportation Commission,GTFS Schedule,NA,Vendor published,,,,,MTC,"SC:Express 101,SC:Express 102,SC:Express 103,SC:Express 104,SC:Express 168",,http://api.511.org/transit/datafeeds?api_key={{ MTC_511_API_KEY}}&operator_id=RG,1 checked out of 1,Core,
VTA ACE Shuttles – Bay Area 511 Schedule,VTA ACE Shuttles,Bay Area 511 Schedule,GTFS Schedule,primary,SC,,fixed-route,Santa Clara Valley Transportation Authority,Santa Clara Valley Transportation Authority,Metropolitan Transportation Commission,Metropolitan Transportation Commission,GTFS Schedule,NA,Vendor published,,,,,MTC,"SC:ACE Gray,SC:ACE GreenSC:ACE Violet,SC:ACE Brown,SC:ACE Yellow,SC:ACE Red,SC:ACE Purple,SC:ACE Orange",,http://api.511.org/transit/datafeeds?api_key={{ MTC_511_API_KEY}}&operator_id=RG,1 checked out of 1,Core,
WestCAT Lynx Express – Bay Area 511 Schedule,WestCAT Lynx Express,Bay Area 511 Schedule,GTFS Schedule,primary,WC,,fixed-route,Western Contra Costa Transit Authority,Western Contra Costa Transit Authority,Metropolitan Transportation Commission,Metropolitan Transportation Commission,GTFS Schedule,NA,Vendor published,,,,,MTC,WC:Lynx,,http://api.511.org/transit/datafeeds?api_key={{ MTC_511_API_KEY}}&operator_id=RG,1 checked out of 1,Core,
WestCAT Express Bus to BART – Bay Area 511 Schedule,WestCAT Express Bus to BART,Bay Area 511 Schedule,GTFS Schedule,primary,WC,,fixed-route,Western Contra Costa Transit Authority,Western Contra Costa Transit Authority,Metropolitan Transportation Commission,Metropolitan Transportation Commission,GTFS Schedule,NA,Vendor published,,,,,MTC,"WC:JR,WC:JL,WC:JX,WC:JPX",,http://api.511.org/transit/datafeeds?api_key={{ MTC_511_API_KEY}}&operator_id=RG,1 checked out of 1,Core,
VTA Rapid Bus – Bay Area 511 Schedule,VTA Rapid Bus,Bay Area 511 Schedule,GTFS Schedule,primary,SC,,fixed-route,Santa Clara Valley Transportation Authority,Santa Clara Valley Transportation Authority,Metropolitan Transportation Commission,Metropolitan Transportation Commission,GTFS Schedule,NA,Vendor published,,,,,MTC,"SC:Rapid 500,SC:Rapid 522,SC:Rapid 523.SC:Rapid 528",,http://api.511.org/transit/datafeeds?api_key={{ MTC_511_API_KEY}}&operator_id=RG,1 checked out of 1,Core,
Valley Medical Center Shuttle – Bay Area 511 Schedule,Valley Medical Center Shuttle,Bay Area 511 Schedule,GTFS Schedule,primary,SC,,fixed-route,Santa Clara Valley Transportation Authority,Santa Clara Valley Transportation Authority,Metropolitan Transportation Commission,Metropolitan Transportation Commission,GTFS Schedule,NA,,,,,,MTC,SC:SCVMC,,http://api.511.org/transit/datafeeds?api_key={{ MTC_511_API_KEY}}&operator_id=RG,1 checked out of 1,Core,
Healdsburg Shuttle – Bay Area 511 Schedule,Healdsburg Shuttle,Bay Area 511 Schedule,GTFS Schedule,primary,SO,,fixed-route,Sonoma County,Sonoma County,Metropolitan Transportation Commission,Metropolitan Transportation Commission,GTFS Schedule,NA,Vendor published,,,,,MTC,SO:67,,http://api.511.org/transit/datafeeds?api_key={{ MTC_511_API_KEY}}&operator_id=RG,1 checked out of 1,Core,
